experiment_id	top_n	n_quantiles	weight_mode	oos_metric	oos_weight_5	seed	oos_return_avg	oos_return_5	oos_return_60	oos_sharpe_5	oos_sharpe_60	oos_max_drawdown_5	oos_max_drawdown_60	oos_turnover_5	oos_turnover_60	fee_bps	best_exprs_sha256	data_end_ts	runner_version	status	description	timestamp
0	40	3	ic_weighted	avg	0.5	112449972	0.26230570530345443	0.22277222138678887	0.30183918922012	4.094957477304915	5.459895921597423	-0.06871127566363622	-0.0514569265983853	0.008565806227572637	0.07788595271210014	10	0a05cb965c8c0da3fb3e7949cb062fd45db9d58e9d70e97ea1de95742a58c760	2026-03-08 17:40:00	autoresearch_genetic50_v2	keep	top_n=40 n_quantiles=3 weight=ic_weighted metric=avg	2026-03-09 19:36:35
1	45	3	ic_weighted	avg	0.5	574832346	0.25748877889558064	0.2131383685710413	0.30183918922012	3.942040595406861	5.459895921597423	-0.07379932579673998	-0.0514569265983853	0.01018636416251881	0.07788595271210014	10	0a05cb965c8c0da3fb3e7949cb062fd45db9d58e9d70e97ea1de95742a58c760	2026-03-08 17:40:00	autoresearch_genetic50_v2	discard	top_n=45 n_quantiles=3 weight=ic_weighted metric=avg	2026-03-09 19:36:40
2	40	5	ic_weighted	avg	0.5	231284486	0.15337645688625134	0.15222131204078182	0.15453160173172087	3.7078557215452332	3.771763053091697	-0.06844620376190758	-0.05284759905157976	0.007292510707257785	0.059805285118219746	10	0a05cb965c8c0da3fb3e7949cb062fd45db9d58e9d70e97ea1de95742a58c760	2026-03-08 17:40:00	autoresearch_genetic50_v2	discard	top_n=40 n_quantiles=5 weight=ic_weighted metric=avg	2026-03-09 19:36:43
3	35	3	ic_weighted	avg	0.5	1829842088	0.1792268761297272	0.1847445184890859	0.1737092337703685	3.484140770153377	3.4108706437588374	-0.07471807929749708	-0.06093540348626392	0.012964463479569395	0.09735744089012517	10	0a05cb965c8c0da3fb3e7949cb062fd45db9d58e9d70e97ea1de95742a58c760	2026-03-08 17:40:00	autoresearch_genetic50_v2	discard	top_n=35 n_quantiles=3 weight=ic_weighted metric=avg	2026-03-09 19:36:47
4	40	3	equal	avg	0.5	1204656741	0.2806828904019356	0.24265956592465843	0.3187062148792128	4.499942823395368	5.784112951831839	-0.06332798418505425	-0.051456926598384745	0.007639773121889107	0.061196105702364396	10	0a05cb965c8c0da3fb3e7949cb062fd45db9d58e9d70e97ea1de95742a58c760	2026-03-08 17:40:00	autoresearch_genetic50_v2	keep	top_n=40 n_quantiles=3 weight=equal metric=avg	2026-03-09 19:36:51
5	45	3	equal	avg	0.5	526484295	0.2538379456676375	0.18896967645606222	0.3187062148792128	3.647940759436417	5.784112951831839	-0.07745875069608954	-0.051456926598384745	0.01018636416251881	0.061196105702364396	10	0a05cb965c8c0da3fb3e7949cb062fd45db9d58e9d70e97ea1de95742a58c760	2026-03-08 17:40:00	autoresearch_genetic50_v2	discard	top_n=45 n_quantiles=3 weight=equal metric=avg	2026-03-09 19:36:55
6	35	3	equal	avg	0.5	150059640	0.20471667163624319	0.2055762677224724	0.20385707555001398	3.8249789502527203	3.936628119558293	-0.07471807929749641	-0.05846257501668273	0.012269938650306749	0.0917941585535466	10	0a05cb965c8c0da3fb3e7949cb062fd45db9d58e9d70e97ea1de95742a58c760	2026-03-08 17:40:00	autoresearch_genetic50_v2	discard	top_n=35 n_quantiles=3 weight=equal metric=avg	2026-03-09 19:36:59
7	10	3	equal	avg	0.5	1432668311	0.1973485419767358	0.19304181407605592	0.20165526987741567	3.6377468937415727	3.888675078889644	-0.07164739853941748	-0.05846257501668306	0.01458502141451557	0.1043115438108484	10	0a05cb965c8c0da3fb3e7949cb062fd45db9d58e9d70e97ea1de95742a58c760	2026-03-08 17:40:00	autoresearch_genetic50_v2	discard	top_n=10 n_quantiles=3 weight=equal metric=avg	2026-03-09 19:37:02
8	40	5	equal	avg	0.5	626638979	0.21125142767298843	0.20289447849691133	0.21960837684906553	4.745159120533068	5.158657904387884	-0.056339701585019886	-0.05145692659838508	0.005208936219469846	0.048678720445062586	10	0a05cb965c8c0da3fb3e7949cb062fd45db9d58e9d70e97ea1de95742a58c760	2026-03-08 17:40:00	autoresearch_genetic50_v2	discard	top_n=40 n_quantiles=5 weight=equal metric=avg	2026-03-09 19:37:06
9	15	3	equal	avg	0.5	1231384489	0.1973485419767358	0.19304181407605592	0.20165526987741567	3.6377468937415727	3.888675078889644	-0.07164739853941748	-0.05846257501668306	0.01458502141451557	0.1043115438108484	10	0a05cb965c8c0da3fb3e7949cb062fd45db9d58e9d70e97ea1de95742a58c760	2026-03-08 17:40:00	autoresearch_genetic50_v2	discard	top_n=15 n_quantiles=3 weight=equal metric=avg	2026-03-09 19:37:10
10	40	5	equal	avg	0.5	1785855699	0.21125142767298843	0.20289447849691133	0.21960837684906553	4.745159120533068	5.158657904387884	-0.056339701585019886	-0.05145692659838508	0.005208936219469846	0.048678720445062586	10	0a05cb965c8c0da3fb3e7949cb062fd45db9d58e9d70e97ea1de95742a58c760	2026-03-08 17:40:00	autoresearch_genetic50_v2	discard	top_n=40 n_quantiles=5 weight=equal metric=avg	2026-03-09 19:37:14
11	35	3	equal	avg	0.5	70933860	0.20471667163624319	0.2055762677224724	0.20385707555001398	3.8249789502527203	3.936628119558293	-0.07471807929749641	-0.05846257501668273	0.012269938650306749	0.0917941585535466	10	0a05cb965c8c0da3fb3e7949cb062fd45db9d58e9d70e97ea1de95742a58c760	2026-03-08 17:40:00	autoresearch_genetic50_v2	discard	top_n=35 n_quantiles=3 weight=equal metric=avg	2026-03-09 19:37:18
12	40	5	equal	avg	0.5	1171361578	0.21125142767298843	0.20289447849691133	0.21960837684906553	4.745159120533068	5.158657904387884	-0.056339701585019886	-0.05145692659838508	0.005208936219469846	0.048678720445062586	10	0a05cb965c8c0da3fb3e7949cb062fd45db9d58e9d70e97ea1de95742a58c760	2026-03-08 17:40:00	autoresearch_genetic50_v2	discard	top_n=40 n_quantiles=5 weight=equal metric=avg	2026-03-09 19:37:22
13	40	5	equal	avg	0.5	2056609260	0.21125142767298843	0.20289447849691133	0.21960837684906553	4.745159120533068	5.158657904387884	-0.056339701585019886	-0.05145692659838508	0.005208936219469846	0.048678720445062586	10	0a05cb965c8c0da3fb3e7949cb062fd45db9d58e9d70e97ea1de95742a58c760	2026-03-08 17:40:00	autoresearch_genetic50_v2	discard	top_n=40 n_quantiles=5 weight=equal metric=avg	2026-03-09 19:37:25
14	30	3	equal	avg	0.5	724084925	0.19977310322045083	0.19568913089088769	0.20385707555001398	3.664075535355036	3.936628119558293	-0.07471807929749741	-0.05846257501668273	0.012269938650306749	0.0917941585535466	10	0a05cb965c8c0da3fb3e7949cb062fd45db9d58e9d70e97ea1de95742a58c760	2026-03-08 17:40:00	autoresearch_genetic50_v2	discard	top_n=30 n_quantiles=3 weight=equal metric=avg	2026-03-09 19:37:29
15	25	3	equal	avg	0.5	1126939725	0.19977310322045083	0.19568913089088769	0.20385707555001398	3.664075535355036	3.936628119558293	-0.07471807929749741	-0.05846257501668273	0.012269938650306749	0.0917941585535466	10	0a05cb965c8c0da3fb3e7949cb062fd45db9d58e9d70e97ea1de95742a58c760	2026-03-08 17:40:00	autoresearch_genetic50_v2	discard	top_n=25 n_quantiles=3 weight=equal metric=avg	2026-03-09 19:37:33
16	40	5	equal	avg	0.5	1569315028	0.21125142767298843	0.20289447849691133	0.21960837684906553	4.745159120533068	5.158657904387884	-0.056339701585019886	-0.05145692659838508	0.005208936219469846	0.048678720445062586	10	0a05cb965c8c0da3fb3e7949cb062fd45db9d58e9d70e97ea1de95742a58c760	2026-03-08 17:40:00	autoresearch_genetic50_v2	discard	top_n=40 n_quantiles=5 weight=equal metric=avg	2026-03-09 19:37:37
17	40	3	ic_weighted	avg	0.5	386110379	0.26230570530345443	0.22277222138678887	0.30183918922012	4.094957477304915	5.459895921597423	-0.06871127566363622	-0.0514569265983853	0.008565806227572637	0.07788595271210014	10	0a05cb965c8c0da3fb3e7949cb062fd45db9d58e9d70e97ea1de95742a58c760	2026-03-08 17:40:00	autoresearch_genetic50_v2	discard	top_n=40 n_quantiles=3 weight=ic_weighted metric=avg	2026-03-09 19:37:41
18	40	3	ic_weighted	avg	0.5	565352072	0.26230570530345443	0.22277222138678887	0.30183918922012	4.094957477304915	5.459895921597423	-0.06871127566363622	-0.0514569265983853	0.008565806227572637	0.07788595271210014	10	0a05cb965c8c0da3fb3e7949cb062fd45db9d58e9d70e97ea1de95742a58c760	2026-03-08 17:40:00	autoresearch_genetic50_v2	discard	top_n=40 n_quantiles=3 weight=ic_weighted metric=avg	2026-03-09 19:37:45
19	30	3	equal	avg	0.5	66824778	0.19977310322045083	0.19568913089088769	0.20385707555001398	3.664075535355036	3.936628119558293	-0.07471807929749741	-0.05846257501668273	0.012269938650306749	0.0917941585535466	10	0a05cb965c8c0da3fb3e7949cb062fd45db9d58e9d70e97ea1de95742a58c760	2026-03-08 17:40:00	autoresearch_genetic50_v2	discard	top_n=30 n_quantiles=3 weight=equal metric=avg	2026-03-09 19:37:48
20	35	3	equal	avg	0.5	904740391	0.20471667163624319	0.2055762677224724	0.20385707555001398	3.8249789502527203	3.936628119558293	-0.07471807929749641	-0.05846257501668273	0.012269938650306749	0.0917941585535466	10	0a05cb965c8c0da3fb3e7949cb062fd45db9d58e9d70e97ea1de95742a58c760	2026-03-08 17:40:00	autoresearch_genetic50_v2	discard	top_n=35 n_quantiles=3 weight=equal metric=avg	2026-03-09 19:37:52
21	40	3	ic_weighted	avg	0.5	335405339	0.26230570530345443	0.22277222138678887	0.30183918922012	4.094957477304915	5.459895921597423	-0.06871127566363622	-0.0514569265983853	0.008565806227572637	0.07788595271210014	10	0a05cb965c8c0da3fb3e7949cb062fd45db9d58e9d70e97ea1de95742a58c760	2026-03-08 17:40:00	autoresearch_genetic50_v2	discard	top_n=40 n_quantiles=3 weight=ic_weighted metric=avg	2026-03-09 19:37:56
22	40	5	equal	avg	0.5	2026229147	0.21125142767298843	0.20289447849691133	0.21960837684906553	4.745159120533068	5.158657904387884	-0.056339701585019886	-0.05145692659838508	0.005208936219469846	0.048678720445062586	10	0a05cb965c8c0da3fb3e7949cb062fd45db9d58e9d70e97ea1de95742a58c760	2026-03-08 17:40:00	autoresearch_genetic50_v2	discard	top_n=40 n_quantiles=5 weight=equal metric=avg	2026-03-09 19:38:00
23	20	3	equal	avg	0.5	2013860926	0.19977310322045083	0.19568913089088769	0.20385707555001398	3.664075535355036	3.936628119558293	-0.07471807929749741	-0.05846257501668273	0.012269938650306749	0.0917941585535466	10	0a05cb965c8c0da3fb3e7949cb062fd45db9d58e9d70e97ea1de95742a58c760	2026-03-08 17:40:00	autoresearch_genetic50_v2	discard	top_n=20 n_quantiles=3 weight=equal metric=avg	2026-03-09 19:38:03
24	40	3	ic_weighted	avg	0.5	1472019406	0.26230570530345443	0.22277222138678887	0.30183918922012	4.094957477304915	5.459895921597423	-0.06871127566363622	-0.0514569265983853	0.008565806227572637	0.07788595271210014	10	0a05cb965c8c0da3fb3e7949cb062fd45db9d58e9d70e97ea1de95742a58c760	2026-03-08 17:40:00	autoresearch_genetic50_v2	discard	top_n=40 n_quantiles=3 weight=ic_weighted metric=avg	2026-03-09 19:38:07
25	45	3	equal	avg	0.5	501571294	0.2538379456676375	0.18896967645606222	0.3187062148792128	3.647940759436417	5.784112951831839	-0.07745875069608954	-0.051456926598384745	0.01018636416251881	0.061196105702364396	10	0a05cb965c8c0da3fb3e7949cb062fd45db9d58e9d70e97ea1de95742a58c760	2026-03-08 17:40:00	autoresearch_genetic50_v2	discard	top_n=45 n_quantiles=3 weight=equal metric=avg	2026-03-09 19:38:11
26	40	3	ic_weighted	avg	0.5	1756892489	0.26230570530345443	0.22277222138678887	0.30183918922012	4.094957477304915	5.459895921597423	-0.06871127566363622	-0.0514569265983853	0.008565806227572637	0.07788595271210014	10	0a05cb965c8c0da3fb3e7949cb062fd45db9d58e9d70e97ea1de95742a58c760	2026-03-08 17:40:00	autoresearch_genetic50_v2	discard	top_n=40 n_quantiles=3 weight=ic_weighted metric=avg	2026-03-09 19:38:15
27	40	5	equal	avg	0.5	1021915122	0.21125142767298843	0.20289447849691133	0.21960837684906553	4.745159120533068	5.158657904387884	-0.056339701585019886	-0.05145692659838508	0.005208936219469846	0.048678720445062586	10	0a05cb965c8c0da3fb3e7949cb062fd45db9d58e9d70e97ea1de95742a58c760	2026-03-08 17:40:00	autoresearch_genetic50_v2	discard	top_n=40 n_quantiles=5 weight=equal metric=avg	2026-03-09 19:38:19
28	50	3	equal	avg	0.5	1490822340	0.15469556456297728	0.038714247678942826	0.27067688144701174	0.9579823936029259	5.049680069426905	-0.12286319632860698	-0.07105065373570374	0.014237758999884246	0.08344923504867872	10	0a05cb965c8c0da3fb3e7949cb062fd45db9d58e9d70e97ea1de95742a58c760	2026-03-08 17:40:00	autoresearch_genetic50_v2	discard	top_n=50 n_quantiles=3 weight=equal metric=avg	2026-03-09 19:38:22
29	15	3	equal	avg	0.5	1125675114	0.1973485419767358	0.19304181407605592	0.20165526987741567	3.6377468937415727	3.888675078889644	-0.07164739853941748	-0.05846257501668306	0.01458502141451557	0.1043115438108484	10	0a05cb965c8c0da3fb3e7949cb062fd45db9d58e9d70e97ea1de95742a58c760	2026-03-08 17:40:00	autoresearch_genetic50_v2	discard	top_n=15 n_quantiles=3 weight=equal metric=avg	2026-03-09 19:38:26
30	40	5	equal	avg	0.5	1677929651	0.21125142767298843	0.20289447849691133	0.21960837684906553	4.745159120533068	5.158657904387884	-0.056339701585019886	-0.05145692659838508	0.005208936219469846	0.048678720445062586	10	0a05cb965c8c0da3fb3e7949cb062fd45db9d58e9d70e97ea1de95742a58c760	2026-03-08 17:40:00	autoresearch_genetic50_v2	discard	top_n=40 n_quantiles=5 weight=equal metric=avg	2026-03-09 19:43:07
31	40	3	ic_weighted	avg	0.5	90769002	0.25349026178475	0.20021275821706164	0.3067677653524383	3.748713486685451	5.5452868453413195	-0.06871127566363622	-0.0514569265983853	0.008565806227572637	0.07788595271210014	10	0a05cb965c8c0da3fb3e7949cb062fd45db9d58e9d70e97ea1de95742a58c760	2026-03-08 17:40:00	autoresearch_genetic50_v2	discard	top_n=40 n_quantiles=3 weight=ic_weighted metric=avg	2026-03-09 19:43:11
32	40	5	equal	avg	0.5	1657681369	0.21125142767298843	0.20289447849691133	0.21960837684906553	4.745159120533068	5.158657904387884	-0.056339701585019886	-0.05145692659838508	0.005208936219469846	0.048678720445062586	10	0a05cb965c8c0da3fb3e7949cb062fd45db9d58e9d70e97ea1de95742a58c760	2026-03-08 17:40:00	autoresearch_genetic50_v2	discard	top_n=40 n_quantiles=5 weight=equal metric=avg	2026-03-09 19:43:14
33	40	5	equal	avg	0.5	1904355776	0.21125142767298843	0.20289447849691133	0.21960837684906553	4.745159120533068	5.158657904387884	-0.056339701585019886	-0.05145692659838508	0.005208936219469846	0.048678720445062586	10	0a05cb965c8c0da3fb3e7949cb062fd45db9d58e9d70e97ea1de95742a58c760	2026-03-08 17:40:00	autoresearch_genetic50_v2	discard	top_n=40 n_quantiles=5 weight=equal metric=avg	2026-03-09 19:43:18
34	35	3	equal	avg	0.5	1876259524	0.20471667163624319	0.2055762677224724	0.20385707555001398	3.8249789502527203	3.936628119558293	-0.07471807929749641	-0.05846257501668273	0.012269938650306749	0.0917941585535466	10	0a05cb965c8c0da3fb3e7949cb062fd45db9d58e9d70e97ea1de95742a58c760	2026-03-08 17:40:00	autoresearch_genetic50_v2	discard	top_n=35 n_quantiles=3 weight=equal metric=avg	2026-03-09 19:43:22
35	40	5	equal	avg	0.5	1710794921	0.21125142767298843	0.20289447849691133	0.21960837684906553	4.745159120533068	5.158657904387884	-0.056339701585019886	-0.05145692659838508	0.005208936219469846	0.048678720445062586	10	0a05cb965c8c0da3fb3e7949cb062fd45db9d58e9d70e97ea1de95742a58c760	2026-03-08 17:40:00	autoresearch_genetic50_v2	discard	top_n=40 n_quantiles=5 weight=equal metric=avg	2026-03-09 20:07:15
36	45	3	equal	avg	0.5	2122441914	0.2538379456676375	0.18896967645606222	0.3187062148792128	3.647940759436417	5.784112951831839	-0.07745875069608954	-0.051456926598384745	0.01018636416251881	0.061196105702364396	10	0a05cb965c8c0da3fb3e7949cb062fd45db9d58e9d70e97ea1de95742a58c760	2026-03-08 17:40:00	autoresearch_genetic50_v2	discard	top_n=45 n_quantiles=3 weight=equal metric=avg	2026-03-09 20:07:19
37	40	3	ic_weighted	avg	0.5	270982952	0.26230570530345443	0.22277222138678887	0.30183918922012	4.094957477304915	5.459895921597423	-0.06871127566363622	-0.0514569265983853	0.008565806227572637	0.07788595271210014	10	0a05cb965c8c0da3fb3e7949cb062fd45db9d58e9d70e97ea1de95742a58c760	2026-03-08 17:40:00	autoresearch_genetic50_v2	discard	top_n=40 n_quantiles=3 weight=ic_weighted metric=avg	2026-03-09 20:07:22
38	40	3	ic_weighted	avg	0.5	162990710	0.26230570530345443	0.22277222138678887	0.30183918922012	4.094957477304915	5.459895921597423	-0.06871127566363622	-0.0514569265983853	0.008565806227572637	0.07788595271210014	10	0a05cb965c8c0da3fb3e7949cb062fd45db9d58e9d70e97ea1de95742a58c760	2026-03-08 17:40:00	autoresearch_genetic50_v2	discard	top_n=40 n_quantiles=3 weight=ic_weighted metric=avg	2026-03-09 20:07:26
39	40	3	ic_weighted	avg	0.5	1582822259	0.26230570530345443	0.22277222138678887	0.30183918922012	4.094957477304915	5.459895921597423	-0.06871127566363622	-0.0514569265983853	0.008565806227572637	0.07788595271210014	10	0a05cb965c8c0da3fb3e7949cb062fd45db9d58e9d70e97ea1de95742a58c760	2026-03-08 17:40:00	autoresearch_genetic50_v2	discard	top_n=40 n_quantiles=3 weight=ic_weighted metric=avg	2026-03-09 20:07:30
40	40	3	ic_weighted	avg	0.5	1197763679	0.12513642318131912	-0.008165015610668291	0.25843786197330654	0.060531411161321214	4.8701545010759375	-0.13923569690246818	-0.07315391442483887	0.022572056951036	0.1043115438108484	10	0a05cb965c8c0da3fb3e7949cb062fd45db9d58e9d70e97ea1de95742a58c760	2026-03-08 17:40:00	autoresearch_genetic50_v2	discard	top_n=40 n_quantiles=3 weight=ic_weighted metric=avg	2026-03-09 20:18:40
41	45	3	equal	avg	0.5	155438741	0.23582718165810945	0.1503082226851078	0.3213461406311111	2.944075127540952	5.8970996290777755	-0.07486859461350603	-0.05873662211581632	0.011228151406412779	0.06954102920723226	10	0a05cb965c8c0da3fb3e7949cb062fd45db9d58e9d70e97ea1de95742a58c760	2026-03-08 17:40:00	autoresearch_genetic50_v2	discard	top_n=45 n_quantiles=3 weight=equal metric=avg	2026-03-09 20:18:44
42	40	5	equal	avg	0.5	1835540487	0.05906716945202811	-0.020515228257012574	0.1386495671610688	-0.3457532920591227	3.439615185592566	-0.15560576195731246	-0.05145692659838497	0.015163792105567774	0.0917941585535466	10	0a05cb965c8c0da3fb3e7949cb062fd45db9d58e9d70e97ea1de95742a58c760	2026-03-08 17:40:00	autoresearch_genetic50_v2	discard	top_n=40 n_quantiles=5 weight=equal metric=avg	2026-03-09 20:18:49
43	40	3	ic_weighted	avg	0.5	558062635	0.12513642318131912	-0.008165015610668291	0.25843786197330654	0.060531411161321214	4.8701545010759375	-0.13923569690246818	-0.07315391442483887	0.022572056951036	0.1043115438108484	10	0a05cb965c8c0da3fb3e7949cb062fd45db9d58e9d70e97ea1de95742a58c760	2026-03-08 17:40:00	autoresearch_genetic50_v2	discard	top_n=40 n_quantiles=3 weight=ic_weighted metric=avg	2026-03-09 20:18:54
44	40	5	equal	avg	0.5	1663340990	0.05906716945202811	-0.020515228257012574	0.1386495671610688	-0.3457532920591227	3.439615185592566	-0.15560576195731246	-0.05145692659838497	0.015163792105567774	0.0917941585535466	10	0a05cb965c8c0da3fb3e7949cb062fd45db9d58e9d70e97ea1de95742a58c760	2026-03-08 17:40:00	autoresearch_genetic50_v2	discard	top_n=40 n_quantiles=5 weight=equal metric=avg	2026-03-09 20:18:58
45	40	5	equal	avg	0.5	241705412	0.05906716945202811	-0.020515228257012574	0.1386495671610688	-0.3457532920591227	3.439615185592566	-0.15560576195731246	-0.05145692659838497	0.015163792105567774	0.0917941585535466	10	0a05cb965c8c0da3fb3e7949cb062fd45db9d58e9d70e97ea1de95742a58c760	2026-03-08 17:40:00	autoresearch_genetic50_v2	discard	top_n=40 n_quantiles=5 weight=equal metric=avg	2026-03-09 20:19:02
46	40	3	ic_weighted	avg	0.5	316484884	0.12513642318131912	-0.008165015610668291	0.25843786197330654	0.060531411161321214	4.8701545010759375	-0.13923569690246818	-0.07315391442483887	0.022572056951036	0.1043115438108484	10	0a05cb965c8c0da3fb3e7949cb062fd45db9d58e9d70e97ea1de95742a58c760	2026-03-08 17:40:00	autoresearch_genetic50_v2	discard	top_n=40 n_quantiles=3 weight=ic_weighted metric=avg	2026-03-09 20:19:07
47	40	3	ic_weighted	avg	0.5	461504968	0.12513642318131912	-0.008165015610668291	0.25843786197330654	0.060531411161321214	4.8701545010759375	-0.13923569690246818	-0.07315391442483887	0.022572056951036	0.1043115438108484	10	0a05cb965c8c0da3fb3e7949cb062fd45db9d58e9d70e97ea1de95742a58c760	2026-03-08 17:40:00	autoresearch_genetic50_v2	discard	top_n=40 n_quantiles=3 weight=ic_weighted metric=avg	2026-03-09 20:19:11
48	40	3	ic_weighted	avg	0.5	1762126913	0.12513642318131912	-0.008165015610668291	0.25843786197330654	0.060531411161321214	4.8701545010759375	-0.13923569690246818	-0.07315391442483887	0.022572056951036	0.1043115438108484	10	0a05cb965c8c0da3fb3e7949cb062fd45db9d58e9d70e97ea1de95742a58c760	2026-03-08 17:40:00	autoresearch_genetic50_v2	discard	top_n=40 n_quantiles=3 weight=ic_weighted metric=avg	2026-03-09 20:19:16
49	40	5	equal	avg	0.5	126400040	0.05906716945202811	-0.020515228257012574	0.1386495671610688	-0.3457532920591227	3.439615185592566	-0.15560576195731246	-0.05145692659838497	0.015163792105567774	0.0917941585535466	10	0a05cb965c8c0da3fb3e7949cb062fd45db9d58e9d70e97ea1de95742a58c760	2026-03-08 17:40:00	autoresearch_genetic50_v2	discard	top_n=40 n_quantiles=5 weight=equal metric=avg	2026-03-09 20:19:20
